{
  "schema_version": "0.1",
  "id": "chiller-pilot",
  "version": "0.1.0",
  "title": "Chiller pilot",
  "description": "The P7g worked example: two chiller sizes with two instrument sets and an air-handling unit linked to a chiller.",
  "stresses": "a small chilled-water plant composed only from the component library: instrument offsets against process faults",
  "axes": {"absence": "signal", "actuation": "advisory", "cadence": ["periodic"], "cardinality": "small", "consequence": ["cost"],
    "correlation": ["independent"], "fidelity": ["F0", "F1"], "lateness": "none", "rate": "low", "seasonality": ["diurnal"],
    "time_reference": "wall", "value_shape": ["scalar"]},
  "site": {"name": "Pilot plant", "timezone": "Europe/Berlin"},
  "areas": [{"name": "Utilities"}, {"name": "Chiller hall", "parent": "Utilities"}, {"name": "Office block", "parent": "Utilities"}],
  "equipment": [
    {"use": "streamsim/chiller@1", "as": "chiller_large", "preset": "large", "parameters": {"setpoint_c": 6.5}, "names": ["CH-1", "CH-2"], "area": "Chiller hall",
      "instruments": {"add": ["chw_flow"]}},
    {"use": "streamsim/chiller@1", "as": "chiller_small", "preset": "small", "names": ["CH-3"], "area": "Chiller hall"},
    {"use": "streamsim/ahu@1", "names": ["AHU-1"], "area": "Office block"}
  ],
  "connections": [{"from": "AHU-1.load_out", "to": "CH-3.load_in"}],
  "profiles": [
    {"name": "nominal", "duration_s": 86400, "description": "A day of the pilot plant, one fault per scenario."},
    {"name": "sensor_pathology", "duration_s": 86400, "fault_weights": {"chiller_large__chw_supply_temp__offset": 1.0, "chiller_small__cond_temp__drift": 1.0},
      "description": "An instrument lies while the process is healthy."},
    {"name": "correlated_cascade", "not_applicable": "Links carry no value until coupling over links (P7h)."}
  ],
  "ground_truth": {"min_per_label": 10, "min_scenarios": 100, "negative_class_fraction": 0.35, "pre_degraded_fraction": 0.0}
}
